username;date;retweets;favorites;text;geo;mentions;hashtags;id;permalink
cebudailynews;2018-11-09 09:15;6;11;"LOOK: The aftermath of the fire that hit a residential area in Sitio Sugarlandia, Barangay Bacayan in Cebu City last night. | Junjie Mendoza pic.twitter.com/U6Ydr1ywyH";;;;"1060702434798952448";https://twitter.com/cebudailynews/status/1060702434798952448
manilabulletin;2018-11-09 08:12;0;1;"LOOK: Fire aftermath in Barangay Bacayan Cebu City. Atleast 9 houses were razed by dawn fire . | via @JuanCarloDeVel3 pic.twitter.com/3CumD50jys";;@JuanCarloDeVel3;;"1060686455746420736";https://twitter.com/manilabulletin/status/1060686455746420736
cebudailynews;2018-11-09 20:53;0;1;"Nine houses razed in Bacayan https://cebudailynews.inquirer.net/202792/nine-houses-razed-in-bacayan?utm_term=Autofeed&utm_medium=Social&utm_source=Twitter#Echobox=1541765067 …";;;#Echobox;"1060877985102917633";https://twitter.com/cebudailynews/status/1060877985102917633
welovemabolo;2018-11-09 10:18;0;0;Our Mabolo Smart Disaster Team is alert in responding to the fire in Sitio Sugarlandia, Barangay Bacayan.";;;#serbisyobarangay #SmartAksyonAgad;"1060718181763952645";https://twitter.com/welovemabolo/status/1060718181763952645
cebudailynews;2018-11-09 09:15;6;11;"LOOK: The aftermath of the fire that hit a residential area in Sitio Sugarlandia , Barangay Bacayan in Cebu City last night. | Junjie Mendoza pic.twitter.com/U6Ydr1ywyH";;;;"1060702434798952448";https://twitter.com/cebudailynews/status/1060702434798952448
_keighsuke;2018-11-09 08:01;0;0;"Fire at sugarlandia";;;;"1060683753649885184";https://twitter.com/_keighsuke/status/1060683753649885184
cebudailynews;2018-11-09 18:34;0;2;"JUST IN: Firefighters from the Basak San Nicolas fire substation have responded to an alarm in Sitio Basak Ubos Puso, Barangay Basak San Nicolas, Cebu City | Benjie Talisic pic.twitter.com/ybHrL9AlKi";;;;"1060842952115740672";https://twitter.com/cebudailynews/status/1060842952115740672
cebudailynews;2018-11-09 09:15;6;11;"LOOK: The aftermath of the fire that hit a residential area in Sitio Sugarlandia, Barangay Bacayan in Cebu City last night. | Junjie Mendoza pic.twitter.com/U6Ydr1ywyH";;;;"1060702434798952448";https://twitter.com/cebudailynews/status/1060702434798952448
manilabulletin;2018-11-09 08:12;0;1;"LOOK: Fire aftermath in Barangay Bacayan Cebu City. Atleast 9 houses were razed by dawn fire . | via @JuanCarloDeVel3 pic.twitter.com/3CumD50jys";;@JuanCarloDeVel3;;"1060686455746420736";https://twitter.com/manilabulletin/status/1060686455746420736