banawedata;2017-12-23 19:17;0;0;"25 still missing after Davao City mall fire http:// newsinfo.inquirer.net/954673/fire-da vao-city-nccc-mall-missing-blaze … via @inquirerdotnet";;@inquirerdotnet;;"944527350527492096";https://twitter.com/banawedata/status/944527350527492096
Noreen_a13;2017-12-23 19:06;0;0;"NCCC MALL DAVAO ON FIRE ? WHAT?";;;;"944524683642224640";https://twitter.com/Noreen_a13/status/944524683642224640
SunStarDavao;2017-12-23 19:03;2;2;"LOOK: FIRE still razing, engulfing NCCC Mall of Davao . via Mark Perandos";;;;"944523884967186432";https://twitter.com/SunStarDavao/status/944523884967186432
mendozadino;2017-12-23 18:56;0;0;"@RRD_ Davao mall fire . If u hav tall bldg u must hav firetruck will reach the top of the highest bldg. MUST have helicopter rescue!!!";;@RRD_;;"944522002341040129";https://twitter.com/mendozadino/status/944522002341040129
kaloymuypuanco;2017-12-23 18:53;0;6;"This NCCC Mall in Davao that’s been on fire literally the entire day (until at this time) has failed obviously on following RA 9514 & PD 1096. It’s either it’s the designer’s fail or the Building Official who inspects and approves. @ABSCBNNews @ANCALERTS";;@ABSCBNNews @ANCALERTS;;"944521363577913344";https://twitter.com/kaloymuypuanco/status/944521363577913344
SunStarDavao;2017-12-23 18:49;0;0;"LOOK: Despite the fire incident at NCCC Mall of Davao (Ma-a branch), the NCCC company continues to pack relief... https:// fb.me/bl9nRZFsX";;;;"944520414889496582";https://twitter.com/SunStarDavao/status/944520414889496582
sunstarcebu;2017-12-23 18:49;0;0;"Based on reports, the fire started on the 3rd floor of the NCCC mall in Davao City at 9:30 a.m. on Saturday, Dec. 23. http:// snstr.co/3cm pic.twitter.com/z00OzmUxN0";;;;"944520230713270272";https://twitter.com/sunstarcebu/status/944520230713270272
izzycaayon;2017-12-23 18:42;1;2;"Davao , you are strong. Yesterday's flood and today's fire is just a bump in the road. We can surpass this! #StayStrongDavao https:// twitter.com/cnnphilippines /status/944441864345731074 …";;;#StayStrongDavao;"944518667630387201";https://twitter.com/izzycaayon/status/944518667630387201
igpitfebev;2017-12-23 18:42;0;0;"Our special thoughts and prayers to those affected by the fire at NCCC Mall today, also to those affected by the flooding from yesterday's heavy rains. What a sad Christmas for the people of Davao City.";;;;"944518642133118977";https://twitter.com/igpitfebev/status/944518642133118977
ThePacificast;2017-12-23 18:23;0;0;"#PacificastNewsfeed | NCCC Mall in Davao City still on fire http:// ift.tt/2DzDtTN";;;#PacificastNewsfeed;"944513690526736384";https://twitter.com/ThePacificast/status/944513690526736384
brevylicious;2017-12-23 18:20;0;1;"Probable Davao headlines tomorrow. 1. Terrible floods in Davao 2. Big fire . 7 hours running. Fire could not be extinguished. I confused.";;;;"944512963519569920";https://twitter.com/brevylicious/status/944512963519569920
Shubham41461806;2017-12-23 18:17;0;0;"https:// youtu.be/28askowrAXs #nccc Mall Davao fire , Fire in Nccc Mall Davao , Nccc Mall Davao , Nccc Mall Davao on fire , fire at Nccc Mall Davao , ACTUAL NA VIDEO NG PAGKASUNOG NG NCCC MALL MAA NG DAVAO CITY, NCCC MALL MAA NASUNOG DAVAO CITY, NCCC MALL NASUNOG DAVAO CITY, BREAKING NEWS";;;#nccc;"944512326488559616";https://twitter.com/Shubham41461806/status/944512326488559616
mydwardooo;2017-12-23 18:15;1;2;"After flash floods last night, sunog naman kaninang umaga. A fire just broke out NCCC Mall Davao this morning. pcto. pic.twitter.com/9Nfe4Y7UVK";;;;"944511787927420928";https://twitter.com/mydwardooo/status/944511787927420928
AksyonTV;2017-12-23 18:13;0;1;"WATCH | Davao City mall fire still not under control after 9 hours: ... https:// goo.gl/fb/3pjkbj #breakingnews";;;#breakingnews;"944511392907964417";https://twitter.com/AksyonTV/status/944511392907964417
ZXPN247;2017-12-23 18:13;0;0;"#ZXPN News | NCCC Mall in Davao City still on fire http://www. sunstar.com.ph/davao/local-ne ws/2017/12/23/nccc-mall-davao-city-still-fire-581107 …";;;#ZXPN;"944511179526955009";https://twitter.com/ZXPN247/status/944511179526955009
mendozadino;2017-12-23 18:13;0;0;"@RRD_ Davao MALL FIRE - AUTO FIRE SPRINLKLER NOT WORKING OR MALFUNCTION OR CORRUPT PERMIT. THIS MUST INPSPECT N TEST, CHECK EVERY 6 MO OR YEARS BY FIRE DEPT. MUST START CHECKING ALL THE BLDGS. NO AUTO FIRE SPRINKLER NI PERMIT AND THE BLDG WILL BE CLOSE UNTIL FIX...";;@RRD_;;"944511172350324736";https://twitter.com/mendozadino/status/944511172350324736
earnestviewer;2017-12-23 18:12;22;30;"Our special thoughts and prayers to those affected by the fire at NCCC Mall today, also to those affected by the flooding from yesterday's heavy rains. What a sad Christmas for the people of Davao City.";;;;"944511004494282752";https://twitter.com/earnestviewer/status/944511004494282752
cnnphilippines;2017-12-23 18:11;36;56;"WATCH: Drone shot of fire in Davao City mall as of 3:06 p.m. | Video courtesy of LouWorks Studio pic.twitter.com/LpOGC1fSet";;;;"944510668333449216";https://twitter.com/cnnphilippines/status/944510668333449216
LiveEdges;2017-12-23 17:58;0;0;"#people #RESCUED 6 rescued in Davao mall fire https://www. google.com/url?rct=j&sa=t &url=http://newsinfo.inquirer.net/954686/6-rescued-in-davao-mall-fire&ct=ga&cd=CAIyGmM3NGU0NzMwNjAzNDIyMTI6Y29tOmVuOlVT&usg=AFQjCNHotLrqPY1mGwNYGiX-SrBFOJdMew … DAVAO CITY—At least six people were rescued from the massive fire that hit one of the large malls here on Saturday, authorities said. As of 4 p.m. firefighters continued to put out the blaze that started past…";;;#people #RESCUED;"944507396315066368";https://twitter.com/LiveEdges/status/944507396315066368
Shubham41461806;2017-12-23 17:58;0;0;"https:// youtu.be/28askowrAXs Nccc Mall Davao fire , Fire in Nccc Mall Davao , Nccc Mall Davao , Nccc Mall Davao on fire , fire at Nccc Mall Davao , ACTUAL NA VIDEO NG PAGKASUNOG NG NCCC MALL MAA NG DAVAO CITY, NCCC MALL MAA NASUNOG DAVAO CITY, NCCC MALL NASUNOG DAVAO CITY, BREAKING NEWS";;;;"944507396310761472";https://twitter.com/Shubham41461806/status/944507396310761472
cnnphilippines;2017-12-23 17:54;9;13;"Fire hits Davao City mall http:// cnn.ph/2l4tw8y pic.twitter.com/4JHyYRWL6q";;;;"944506553075343360";https://twitter.com/cnnphilippines/status/944506553075343360
Shubham77808234;2017-12-23 17:49;0;1;"Nccc Mall Davao fire | Fire in Nccc Mall Davao |Nccc Mall Davao fire |Nccc Mall Davao on fire : http:// youtu.be/28askowrAXs?a via @YouTube";;@YouTube;;"944505133890666497";https://twitter.com/Shubham77808234/status/944505133890666497
miriamgracego;2017-12-23 17:47;0;0;"Search continues for missing in Davao City mall fire https://www. rappler.com/nation/192092- davao-nccc-mall-fire-missing-persons … via @rapplerdotcom";;@rapplerdotcom;;"944504800397246464";https://twitter.com/miriamgracego/status/944504800397246464
Shubham77808234;2017-12-23 17:45;0;2;"I added a video to a @YouTube playlist http:// youtu.be/28askowrAXs?a Nccc Mall Davao fire | Fire in Nccc Mall Davao |Nccc Mall Davao fire |Nccc";;@YouTube;;"944504289208209409";https://twitter.com/Shubham77808234/status/944504289208209409
ThePacificast;2017-12-23 17:43;0;0;"#PacificastNewsfeed | NCCC Mall in Davao City still engulf in fire http:// ift.tt/2pmqa6e";;;#PacificastNewsfeed;"944503680044236800";https://twitter.com/ThePacificast/status/944503680044236800
phildaily;2017-12-23 17:40;0;0;"Fire hits Davao mall - Manila Bulletin https:// goo.gl/fb/VVRYJY";;;;"944502943960719360";https://twitter.com/phildaily/status/944502943960719360
jalinjason;2017-12-23 17:39;0;0;"The FBI Davao just declared that all missing people (esp SSI Agents) who were trapped inside at 3rd & 4th floor were DEAD. The fire went down to 2nd &ground floor, meaning they were eaten up by the huge fire . I HOPE THIS IS NOT TRUE. I HOPE THEY'RE WRONG. PLEASE. pic.twitter.com/rNVdV4grR7";;;;"944502781624311808";https://twitter.com/jalinjason/status/944502781624311808
broncophils;2017-12-23 17:34;0;0;"Retweeted GMA News ( @gmanews ): A fire of still undetermined origin hit a major shopping center in Davao City on... https:// fb.me/Dx7FWwBt";;@gmanews;;"944501581277360130";https://twitter.com/broncophils/status/944501581277360130
emelitatimkang;2017-12-23 17:34;0;0;"Fire at NCCC Mall of Davao";;;;"944501360438886400";https://twitter.com/emelitatimkang/status/944501360438886400
ElisseJoson_dvo;2017-12-23 17:27;0;1;"Fire in NCCC Mall and floods around Davao happened before Christmas. This is so heartbreaking! Stay safe everyone! Stay safe! This too shall pass.";;;;"944499671174541313";https://twitter.com/ElisseJoson_dvo/status/944499671174541313
PHTopNews;2017-12-23 17:26;0;0;"6 rescued in Davao mall fire - http:// Inquirer.net https:// goo.gl/fb/6NhZGb";;;;"944499524931788801";https://twitter.com/PHTopNews/status/944499524931788801
nerowattz;2017-12-23 17:19;0;0;"6 rescued in Davao mall fire http:// inq.ph/inqmobileapp InquirerMobile http:// ift.tt/2Bq9rjQ";;;;"944497633158139905";https://twitter.com/nerowattz/status/944497633158139905
NCorralesINQ;2017-12-23 17:18;23;32;"LOOK: Fire hits NCCC Mall in Davao City. Photos from SAP Christopher "Bong" Go. @inquirerdotnet pic.twitter.com/sIZzRmwMeU";;@inquirerdotnet;;"944497551234830336";https://twitter.com/NCorralesINQ/status/944497551234830336
manilabulletin;2017-12-23 17:18;1;8;"FULL STORY: Fire hits Davao mall https:// news.mb.com.ph/2017/12/23/fir e-hits-davao-mall/ …";;;;"944497329154834433";https://twitter.com/manilabulletin/status/944497329154834433
Eeduuhhh;2017-12-23 17:09;0;0;"Storm. Flood. Fire . Feels like the end of the world. Praying for you, davao .";;;;"944495120006635520";https://twitter.com/Eeduuhhh/status/944495120006635520
marvingil;2017-12-23 16:59;1;3;"Praying for everyone affected by the typhoon, flood and fire . Lord, have mercy. #Davao";;;#Davao;"944492660865228800";https://twitter.com/marvingil/status/944492660865228800
ZXPN247;2017-12-23 16:58;0;0;"#ZXPN News | NCCC Mall in Davao City still engulf in fire http://www. sunstar.com.ph/davao/local-ne ws/2017/12/23/nccc-mall-davao-city-still-engulf-fire-581107 …";;;#ZXPN;"944492341188063232";https://twitter.com/ZXPN247/status/944492341188063232
gmanews;2017-12-23 16:56;5;12;"A fire of still undetermined origin hit a major shopping center in Davao City on Saturday morning, trapping several people inside. http:// gmane.ws/2D11VMB";;;;"944491771081428992";https://twitter.com/gmanews/status/944491771081428992
FilipinosInAus;2017-12-23 16:55;0;0;"Fire Breaks out at one of Davao 's Biggest Malls the NCCC http:// youtu.be/5kpQjufTv9E?a";;;;"944491634804355072";https://twitter.com/FilipinosInAus/status/944491634804355072
emiliasinophil;2017-12-23 16:54;0;1;"I dont get why they put malice on SnR helping rescuers as damage control. Yeah the SnR Davao manager incident was terrible, but maybe the pizza giving came from a different person and also their contribution to help people working their way on the NCCC fire .";;;;"944491434987552769";https://twitter.com/emiliasinophil/status/944491434987552769
def_filipino;2017-12-23 16:52;0;0;"The Davao City police said the fire started shortly after the mall opened for the Christmas shopping rush... https:// fb.me/1sWye6uqK";;;;"944490990311755776";https://twitter.com/def_filipino/status/944490990311755776
GMANewsTVIntl;2017-12-23 16:48;0;0;"Fire hits Davao City mall, traps people inside http:// dlvr.it/Q7HLwG pic.twitter.com/rPBOq8U7qd";;;;"944489783631347713";https://twitter.com/GMANewsTVIntl/status/944489783631347713
LOCALNEWSNgayon;2017-12-23 16:46;0;0;"Fire hits Davao City mall, traps people inside | Read: http:// ift.tt/2BrzYNS via GMA News";;;;"944489318911021056";https://twitter.com/LOCALNEWSNgayon/status/944489318911021056
kemmebebe;2017-12-23 16:43;13;21;"Friends, let us please include in our prayers our friends who have been missing since fire brokeout this morning at the NCCC Mall in Davao . https:// twitter.com/demi3a/status/ 944486589522001920 …";;;;"944488643661463552";https://twitter.com/kemmebebe/status/944488643661463552
jdesignz;2017-12-23 16:38;0;0;"Fire hits Davao City mall, traps people inside http:// ift.tt/2BrzYNS http:// ift.tt/eA8V8J";;;;"944487328617324544";https://twitter.com/jdesignz/status/944487328617324544
kinkyGD;2017-12-23 16:31;0;0;"Meanwhile in davao , bankerohan river has worsen and so is the fire in nccc mall";;;;"944485514723209217";https://twitter.com/kinkyGD/status/944485514723209217
ThePacificast;2017-12-23 16:28;0;0;"#PacificastNewsfeed | Fire hits NCCC Mall in Davao City http:// ift.tt/2ziiXn7";;;#PacificastNewsfeed;"944484819672723456";https://twitter.com/ThePacificast/status/944484819672723456
sunstaronline;2017-12-23 16:24;1140;3340;"LOOK: S&R, a membership shopping establishment beside NCCC, offers fire fighters, volunteers and the rest of the rescue team free pizza. As of 3: 46 p.m., fire is still razing the homegrown mall. | via Macky Lim/SunStar Davao pic.twitter.com/p0rJzuMpu6";;;;"944483965276078081";https://twitter.com/sunstaronline/status/944483965276078081
inquirerdotnet;2017-12-23 16:23;2;6;"25 still missing after Davao City mall fire | @inqmindanao http:// newsinfo.inquirer.net/954673/fire-da vao-city-nccc-mall-missing-blaze …";;@inqmindanao;;"944483496222846976";https://twitter.com/inquirerdotnet/status/944483496222846976
jalinjason;2017-12-23 16:22;18;35;"Here's the complete list of missing SSI Agents during the Fire in NCCC Maa, Davao City. Has anyone seen them?? Please contact the police ASAP. Please SPREAD to help. This broke me since I was a former SSI Agent and my friends were still there. pic.twitter.com/Yxd7iayvyu";;;;"944483373463977985";https://twitter.com/jalinjason/status/944483373463977985
taemaikey;2017-12-23 16:17;0;0;"The fire in Davao ...the flood around Mindanao....I can’t take all these please";;;;"944482127428534274";https://twitter.com/taemaikey/status/944482127428534274
sunstaronline;2017-12-23 16:17;1;6;"LOOK. SAP Christopher "Bong" Go at the fire scene of the NCCC Mall in Davao City; says P-Duterte is monitoring the fire situation as well as the flooding in some areas in Davao City. | via @SunStarDavao Photos by Macky Lim pic.twitter.com/3Sxxwj5mnO";;@SunStarDavao;;"944482119337746433";https://twitter.com/sunstaronline/status/944482119337746433
MickBasa;2017-12-23 16:16;0;1;"We're also waiting for @SSITweets 's statement on the fire in Davao City. Still many employees are missing. No official numbers yet.";;@SSITweets;;"944481866408534016";https://twitter.com/MickBasa/status/944481866408534016
nerowattz;2017-12-23 16:14;0;0;"25 still missing after Davao City mall fire http:// inq.ph/inqmobileapp InquirerMobile http:// ift.tt/2BokZUP";;;;"944481272159760386";https://twitter.com/nerowattz/status/944481272159760386
MickBasa;2017-12-23 16:11;1;1;"Search continues for missing in Davao City mall fire https://www. rappler.com/nation/192092- davao-nccc-mall-fire-missing-persons …";;;;"944480647363489792";https://twitter.com/MickBasa/status/944480647363489792
cgnetwork;2017-12-23 16:03;0;0;"Search continues for missing in Davao City mall fire : DAVAO CITY, Philippines – Rescuers… https:// goo.gl/fb/tXrctX";;;;"944478432825667584";https://twitter.com/cgnetwork/status/944478432825667584
SarahAbilar;2017-12-23 15:45;0;0;"Fire hits NCCC mall davao . pic.twitter.com/bYJXG5A9zz";;;;"944473908169682946";https://twitter.com/SarahAbilar/status/944473908169682946
glaissaviola;2017-12-23 15:36;1;3;"Flash flood plus fire incident in Davao . My heart is breaking.";;;;"944471729027477505";https://twitter.com/glaissaviola/status/944471729027477505
rapplerdotcom;2017-12-23 15:26;20;26;"Rescuers here are still looking for more than 10 people believed to be trapped inside a Davao City mall hit by fire . #PHNews https://www. rappler.com/nation/192092- davao-nccc-mall-fire-missing-persons?utm_source=twitter&utm_medium=social&utm_campaign=nation …";;;#PHNews;"944469138734501889";https://twitter.com/rapplerdotcom/status/944469138734501889
piaranada;2017-12-23 15:25;1;5;"Search continues for missing in Davao City mall fire | via @rapplerdotcom http:// s.rplr.co/6LVciIF";;@rapplerdotcom;;"944468944043196417";https://twitter.com/piaranada/status/944468944043196417
leilasxntos;2017-12-23 15:10;0;0;"FLOOD- FIRE WHAT IS WRONG WITH DAVAO";;;;"944465227646615553";https://twitter.com/leilasxntos/status/944465227646615553
jusssyjay;2017-12-23 15:01;0;4;"It has been five hours since the fire started yet our area still is covered in thick smoke. More firetrucks circling the area. Light to moderate traffic along Ma-a Rd. (outbound, NCCC). For those entering Ma-a from McArthur, authorities closed inbound. #Davao pic.twitter.com/yCr49904i2";;;#Davao;"944463009744695298";https://twitter.com/jusssyjay/status/944463009744695298
phildaily;2017-12-23 14:51;0;0;"Fire hits NCCC Mall in Davao City | SunStar - http:// Sun.Star https:// goo.gl/fb/AzWc5f";;;;"944460454423908358";https://twitter.com/phildaily/status/944460454423908358
phildaily;2017-12-23 14:51;0;0;"Fire hits NCCC Mall in Davao City | SunStar - http:// Sun.Star https:// goo.gl/fb/DvKEsf";;;;"944460388367822849";https://twitter.com/phildaily/status/944460388367822849
KUMONOUENOBANAN;2017-12-23 14:46;9;60;"GAISANO MALL 火災発生... 黒煙が遠くからも確認できます... クリスマス前の悲しい出来事... 被害が最小限になることを祈るばかりです。 Fire breaks out in Davao City mall, over 10 missing http:// davaotoday.com/main/davao-cit y/nccc-mall-davao-city-fire/ … @davaotoday さんから";;@davaotoday;;"944459284066197504";https://twitter.com/KUMONOUENOBANAN/status/944459284066197504
alexand94922108;2017-12-23 14:36;0;0;"BREAKING NEWS: NCCC Mall - Maa, Davao City fire still on going. HAPPENING NOW: Fire at the 3rd floor of NCCC... https:// fb.me/9b9HX5fSl";;;;"944456562080227328";https://twitter.com/alexand94922108/status/944456562080227328
BeseosEvan;2017-12-23 14:35;0;0;"Earth ug Wind nlng daw kulang sa Davao Kay humana ang Water ug Fire Hooooy! simbahan!";;;;"944456377124012036";https://twitter.com/BeseosEvan/status/944456377124012036
DavaoToday;2017-12-23 14:25;2;2;"Fire breaks out in Davao City mall, over 10 missing http:// davaotoday.com/main/davao-cit y/nccc-mall-davao-city-fire/ …";;;;"944454010257391616";https://twitter.com/DavaoToday/status/944454010257391616
TheUrbanNewz;2017-12-23 14:11;0;0;"Fire hits NCCC Mall in Davao City | SunStar - http:// Sun.Star http:// news.google.com/news/url?sa=t& fd=R&ct2=en_ph&usg=AFQjCNEhlPD0M9W-q9V0gYLDm_u0EUT8aA&clid=c3a7d30bb8a4878e06b80cf16b898331&cid=52779731438242&ei=U_M9WtikBoP5qgLSu5yADw&url=http%3A%2F%2Fwww.sunstar.com.ph%2Fdavao%2Flocal-news%2F2017%2F12%2F23%2Ffire-hits-nccc-mall-davao-city-581107&utm_source=dlvr.it&utm_medium=twitter … pic.twitter.com/46JQnmhgyZ";;;;"944450280485142528";https://twitter.com/TheUrbanNewz/status/944450280485142528
andylandro;2017-12-23 14:06;0;1;"Now in Davao . Some areas are still in Flood and NCCC Mall is on Fire . Keep safe Dabaweños!";;;;"944449178670735360";https://twitter.com/andylandro/status/944449178670735360
sunstaronline;2017-12-23 14:06;4;3;"Fire hits NCCC Mall in Davao City. Here's the story | http:// snstr.co/3cc pic.twitter.com/lIZbpsWgO6";;;;"944449010101661696";https://twitter.com/sunstaronline/status/944449010101661696
manilabulletin;2017-12-23 14:04;221;529;"LOOK: Fire still raging at NCCC Mall in Davao City. | @keithbacongco pic.twitter.com/B8LY7jXthg";;@keithbacongco;;"944448734577881088";https://twitter.com/manilabulletin/status/944448734577881088
ZXPN247;2017-12-23 14:04;0;0;"#ZXPN News | Fire hits NCCC Mall in Davao City http:// on.zxpn.ml/fire-hits-nccc -mall-in-davao-city/ …";;;#ZXPN;"944448568475246592";https://twitter.com/ZXPN247/status/944448568475246592
keithbacongco;2017-12-23 14:04;2;1;"Fire still raging at NCCC Mall in Davao City. @manilabulletin pic.twitter.com/iqG3n8MFBu";;@manilabulletin;;"944448532332736512";https://twitter.com/keithbacongco/status/944448532332736512
TheUrbanNewz;2017-12-23 14:04;0;0;"Fire breaks out at one of Davao 's biggest malls - http:// Inquirer.net http:// news.google.com/news/url?sa=t& fd=R&ct2=en_ph&usg=AFQjCNEiDYG_ZmfmkebsHq9e3f_o-uF_hw&clid=c3a7d30bb8a4878e06b80cf16b898331&cid=52779731438242&ei=tvE9WpCAGomKqwKM6a7ABw&url=https%3A%2F%2Fnewsinfo.inquirer.net%2F954627%2Ffire-breaks-out-at-one-of-davaos-biggest-malls&utm_source=dlvr.it&utm_medium=twitter … pic.twitter.com/CO4U3KeCTz";;;;"944448501085233152";https://twitter.com/TheUrbanNewz/status/944448501085233152
BarkoNgALE;2017-12-23 14:01;2;15;"#VintaPH , Flood/Overflowing river, NCCC Mall Fire in a span of more or less 24hrs. Keep safe Davao .";;;#VintaPH;"944447749340110848";https://twitter.com/BarkoNgALE/status/944447749340110848
MajesticNicole;2017-12-23 13:57;0;0;"An Amtrack crashed in the town next to my hometown. A fire started in a mall here in Davao and a flood wiped out a bunch of houses here too";;;;"944446784356605952";https://twitter.com/MajesticNicole/status/944446784356605952
greenbluelwt;2017-12-23 13:45;2;3;"Now that Christmas is right around the corner, so many horrible things are happening! The flood in some parts in Mindanao and Visayas due to #TropicalDepressionVinta , and now a fire is currently happening at NCCC Mall in Davao . All we can do right now is pray that it will all-";;;#TropicalDepressionVinta;"944443908251049984";https://twitter.com/greenbluelwt/status/944443908251049984
bombasstae;2017-12-23 13:40;0;2;"wow great. tropical storm that leads to a big flood and evacuating of many people and now one of the biggest malls in davao was on fire . what a great way to start christmas. keep safe everyone :) better days are coming";;;;"944442577704464385";https://twitter.com/bombasstae/status/944442577704464385
cnnphilippines;2017-12-23 13:37;311;560;"WATCH: Fire at NCCC Mall in Davao City as of 11:15 a.m. According to the official statement of the mall, the situation is already under the control of the Bureau of Fire Protection. | Video courtesy of SJ de Ocampo pic.twitter.com/IE629EOjPf";;;;"944441864345731074";https://twitter.com/cnnphilippines/status/944441864345731074
sunstaronline;2017-12-23 13:32;8;11;"LOOK. Fire breaks out at Davao City's NCCC Mall in Maa at 9:30 a.m. Friday, Dec. 23. | Photos by Yette Revita @SunStarDavao pic.twitter.com/LQarIFFnES";;@SunStarDavao;;"944440495140302849";https://twitter.com/sunstaronline/status/944440495140302849
enzocytosis;2017-12-23 13:27;1;4;"stupid people connecting the Davao flood and NCCC Fire to Digong. paghilom mo ui!";;;;"944439241127297025";https://twitter.com/enzocytosis/status/944439241127297025
AeriBellee;2017-12-23 13:25;34;68;"After flash floods last night, NCCC Mall Davao is on fire Stay safe Dabawenyos Crdt pictures to owners. pic.twitter.com/IM6k0EXwvA";;;;"944438702998089729";https://twitter.com/AeriBellee/status/944438702998089729
MickBasa;2017-12-23 13:23;23;51;"Fire gutting down west part of NCCC Mall in Ma-a, Davao City pic.twitter.com/KRSY81ZyLt";;;;"944438167586750464";https://twitter.com/MickBasa/status/944438167586750464
camSAMnida_;2017-12-23 13:20;0;2;"Last night flood. This morning fire . Stay strong Davao";;;;"944437620611760130";https://twitter.com/camSAMnida_/status/944437620611760130
swittany;2017-12-23 13:19;0;0;"Fire amd rain. Too much going on in my hometown My thoughts and prayers are with you Davao and Davaowenyos.... https:// fb.me/1vbFBNrxr";;;;"944437275135442944";https://twitter.com/swittany/status/944437275135442944
yusufledesma;2017-12-23 13:12;1;0;"Fire breaks out at one of Davao ’s biggest malls http:// newsinfo.inquirer.net/954627/fire-br eaks-out-at-one-of-davaos-biggest-malls … via @inquirerdotnet";;@inquirerdotnet;;"944435522360848384";https://twitter.com/yusufledesma/status/944435522360848384
manilabulletin;2017-12-23 13:06;83;124;"LOOK: Fire incident at NCCC Mall, Maa Davao City. Fire started at the 3rd floor particularly at the furniture section going to 4th floor at SSI call center office. Fire fighters and 911 rescuers are still conducting searched and retrievals on trapped persons. ( : Yas Ocampo) pic.twitter.com/nfS4gUFc6J";;;;"944433982036254720";https://twitter.com/manilabulletin/status/944433982036254720
legenDARSY;2017-12-23 13:05;0;0;"when you need rain for the fire pero yung mga nabahaan naman oh my god Davao , please stay strong";;;;"944433691383627776";https://twitter.com/legenDARSY/status/944433691383627776
SunStarDavao;2017-12-23 13:03;1;0;"If you want to reach the flood and fire victims in Davao City, here's how you can help. PLEASE DIRECT YOUR... https:// fb.me/2wrig0Nny";;;;"944433266039418882";https://twitter.com/SunStarDavao/status/944433266039418882
PTVph;2017-12-23 13:02;8;5;"A fire broke out at NCCC Mall located in Maa, Davao City early morning, December 23. The BFP firefighters are still trying to suppress the fire . The mall was temporary close and mall-goers and employees were forcibly evacuated. © Sunstar Davao | via @UMhangout pic.twitter.com/LTmEvBakRm";;@UMhangout;;"944432913684111360";https://twitter.com/PTVph/status/944432913684111360
Hardwaremaxx;2017-12-23 12:43;0;0;"#OfficialStatement It is unfortunate that we confirm that there was a fire at the 3rd floor of NCCC Mall Davao ... https:// fb.me/CX9WokEb";;;#OfficialStatement;"944428284959449088";https://twitter.com/Hardwaremaxx/status/944428284959449088
kWiDnAnk;2017-12-23 12:42;0;0;"NCCC MALL OF DAVAO UNDER FIRE .";;;;"944428082907062272";https://twitter.com/kWiDnAnk/status/944428082907062272
sarielvillano;2017-12-23 12:35;0;0;"NCCC MALL of Davao on fire (12/23/2017 11:45am) https:// fb.me/3mJndknsn";;;;"944426182904250369";https://twitter.com/sarielvillano/status/944426182904250369
diana_daniel;2017-12-23 12:34;0;0;"NCCC Davao Fire Update https:// fb.me/4bqlVmapT";;;;"944425933183897600";https://twitter.com/diana_daniel/status/944425933183897600
