username;date;retweets;favorites;text;geo;mentions;hashtags;id;permalink
Cebuinformer;2018-11-15 01:44;0;0;"30 houses went up in smoke: Lorega fire kills 1 https://cebuinformer.com/221587/30-hous es-went-up-in-smoke-lorega-fire-kills-1/ … pic.twitter.com/LB1QFJL4JN";;;;"1062763218542698496";https://twitter.com/Cebuinformer/status/1062763218542698496
cebudailynews;2018-11-14 21:20;0;1;"Fire hits Barangay Lorega , Cebu City https://cebudailynews.inquirer.net/203596/fire-hi ts-barangay-lorega-cebu-city?utm_term=Autofeed&utm_medium=Social&utm_source=Twitter#Echobox=1542198022 …";;;#Echobox;"1062696893153730560";https://twitter.com/cebudailynews/status/1062696893153730560
DelleraFaith;2018-11-14 19:24;1;8;"pray for lorega ! Firetrucks keep passing through my school.";;;;"1062667486145863681";https://twitter.com/DelleraFaith/status/1062667486145863681
atonibaicebu;2018-11-14 17:27;0;0;"Fire broke in Lorega https://www.facebook.com/100008540433376/posts/1968935793401083/ … https://www.facebook.com/cebucity/posts /10156723830151250 …";;;;"1062638166635622400";https://twitter.com/atonibaicebu/status/1062638166635622400
cebudailynews;2018-11-14 17:09;0;0;"LOOK: Remains of Amado Opura who died in a fire that hit Barangay Lorega San Miguel, Cebu City | Junjie Mendoza pic.twitter.com/QwgwvHvUOw";;;;"1062633620534321152";https://twitter.com/cebudailynews/status/1062633620534321152
atonibaicebu;2018-11-14 17:02;0;0;"Fire broke in Lorega https://www.facebook.com/100008540433376/posts/1968935793401083/ … https://www.facebook.com/311876150591/p osts/10155830028240592/ …";;;;"1062631929361645569";https://twitter.com/atonibaicebu/status/1062631929361645569
cebudailynews;2018-11-14 16:43;2;3;"One is confirmed dead after a fire struck a densely populated area in Barangay Lorega San Miguel, Cebu City past 3 p.m. today, Wednesday. Read more: https://cebudailynews.inquirer.net/203591/one-dea d-in-lorega-fire#ixzz5Woi1NNlN … pic.twitter.com/Ppa00n5D8p";;;#ixzz5Woi1NNlN;"1062627107648360448";https://twitter.com/cebudailynews/status/1062627107648360448
cebudailynews;2018-11-14 16:37;1;2;"LOOK: More scenes during the fire that hit Barangay Lorega , Cebu City | Junjie Mendoza pic.twitter.com/rjIZJHmFGV";;;;"1062625600576282624";https://twitter.com/cebudailynews/status/1062625600576282624
TheFreemanNews;2018-11-14 16:21;0;3;"LATEST: One dead in ongoing Lorega fire in Cebu City, confirms Fire Marshall Noel Nelson Ababon | via Rowena Capistrano pic.twitter.com/TChoylFwfs";;;;"1062621498026807296";https://twitter.com/TheFreemanNews/status/1062621498026807296
cebudailynews;2018-11-14 16:10;0;2;"LOOK: Cebu Vice Mayor Edgardo Labella comforted two kids after they were left behind by their family in a fire that hit Barangay Lorega , Cebu City | Junjie Mendoza pic.twitter.com/TWmvHha9IT";;;;"1062618740288708608";https://twitter.com/cebudailynews/status/1062618740288708608
CebuFlashReport;2018-11-14 16:08;0;0;"#CFRSunogUpdate Fire under control at Brgy. Lorega . https://www.facebook.com/cebuflashrepor t/videos/176725469944680/ …";;;#CFRSunogUpdate;"1062618321709875200";https://twitter.com/CebuFlashReport/status/1062618321709875200
cebudailynews;2018-11-14 16:08;2;0;"WATCH: Firefighters retrieve uncooked chicken that were left in a lechon-manok (roast chicken) station during the fire that hit Barangay Lorega , Cebu City | Morexette Erram pic.twitter.com/0e1nJQXsd2";;;;"1062618159851565056";https://twitter.com/cebudailynews/status/1062618159851565056
rapplerdotcom;2018-11-14 15:49;3;9;"Fire alert: A fire in Sitio San Miguel, Barangay Lorega , Cebu City has been raised to third alarm. : Jake Yap pic.twitter.com/elO1i6SgJ6";;;;"1062613501460471808";https://twitter.com/rapplerdotcom/status/1062613501460471808
cebudailynews;2018-11-14 15:48;1;2;"Fire in Barangay Lorega , Cebu City now under control | @ememsanCDN https://twitter.com/cebudailynews/status/1062601046789316608 …";;@ememsanCDN;;"1062613185927106560";https://twitter.com/cebudailynews/status/1062613185927106560
BrgyTalamban;2018-11-14 15:41;0;0;"FIRE ALARM!!!! NEWS UPDATE: The fire which hit an urban poor community in Sitio San Miguel, Barangay Lorega , Cebu City was already raised to third alarm. The fire was reported at 3:08 p.m. and affected structures built along the new Imus road.";;;;"1062611586987294720";https://twitter.com/BrgyTalamban/status/1062611586987294720
henry_manatad;2018-11-14 15:37;0;0;"Fire in Barangay Lorega - San Miguel along Imus Road. Heavy traffic in the connecting General Maxilom Ave. and M.J. Cuenco Avenue";;;;"1062610532371435525";https://twitter.com/henry_manatad/status/1062610532371435525
cebudailynews;2018-11-14 15:33;1;2;"NEWS UPDATE: The fire which hit an urban poor community in Sitio San Miguel, Barangay Lorega , Cebu City was already raised to third alarm. The fire was reported at 3:08 p.m. and affected structures built along the new Imus road | @dbongcac pic.twitter.com/u0h74IL22O";;@dbongcac;;"1062609470906261504";https://twitter.com/cebudailynews/status/1062609470906261504
cebudailynews;2018-11-14 15:31;0;2;"LOOK: Scenes during the fire that hit Barangay Lorega , Cebu City | Junjie Mendoza pic.twitter.com/MyUGUks5CK";;;;"1062609041937981440";https://twitter.com/cebudailynews/status/1062609041937981440
TheFreemanNews;2018-11-14 15:27;1;2;"LOOK: Fire razes houses in Sitio San Miguel, Barangay Lorega , Cebu City | via Aldo Banaynal pic.twitter.com/FMRR3ntq5W";;;;"1062607917067624449";https://twitter.com/TheFreemanNews/status/1062607917067624449
cebudailynews;2018-11-14 15:24;3;15;"LOOK: Houses and establishments were burned in a fire that hit Barangay Lorega , Cebu City this afternoon ( November 14) | Junjie Mendoza and Paul Lauro pic.twitter.com/qtTKY8aHP9";;;;"1062607193877307393";https://twitter.com/cebudailynews/status/1062607193877307393
cebudailynews;2018-11-14 15:17;0;0;"Fire alarm in Barangay Lorega now raised to third alarm. https://twitter.com/cebudailynews/status/1062601046789316608 …";;;;"1062605472874749952";https://twitter.com/cebudailynews/status/1062605472874749952
manilabulletin;2018-11-14 15:17;0;0;"#FireAlert : Ongoing fire at a residential area in Barangay Lorega , Cebu City | via @JuanCarloDeVel3 pic.twitter.com/LaiN7LJl8L";;@JuanCarloDeVel3;#FireAlert;"1062605371632627713";https://twitter.com/manilabulletin/status/1062605371632627713
cebudailynews;2018-11-14 15:08;1;3;"LOOK: Black smoke seen billowing from the fire in Barangay Lorega , Cebu City | Doris Mondragon pic.twitter.com/HFpBM6L0hw";;;;"1062603264972050432";https://twitter.com/cebudailynews/status/1062603264972050432
TheFreemanNews;2018-11-14 15:06;1;0;"BREAKING: Fire alarm in Lorega , Cebu City | via @jdestacamentoTF pic.twitter.com/sb2qicACSp";;@jdestacamentoTF;;"1062602709126197248";https://twitter.com/TheFreemanNews/status/1062602709126197248
sunstarcebu;2018-11-14 15:06;4;3;"BREAKING: Fire alarm in Lorega St., Cebu City. More details to follow. pic.twitter.com/43jXlrJzEl";;;;"1062602559855067136";https://twitter.com/sunstarcebu/status/1062602559855067136
renzodelro;2018-11-14 15:03;0;0;"FIRE ALARM IN PROGRESS LOCATION NEW LOREGA ROAD, BRGY. LOREGA , CEBU CITY INVOLVING RESIDENTIAL";;;;"1062601987936735232";https://twitter.com/renzodelro/status/1062601987936735232
cebudailynews;2018-11-14 15:00;2;4;"JUST IN: Authorities are now responding to a fire alarm in Barangay Lorega , Cebu City | Junjie Mendoza pic.twitter.com/SC0yPcUPoh";;;;"1062601046789316608";https://twitter.com/cebudailynews/status/1062601046789316608
specialchad;2018-11-14 21:55;1255;2474;"A child kept weeping, Temporary shelters of 550 families who are victims of a 2016 fire incident were demolished this morning in Mandaue City, Cebu . The evacuees are now left w/no relocation. pic.twitter.com/j39C2rLTvO – bei Cebu International Convention Center";;;;"1062705651363672064";https://twitter.com/specialchad/status/1062705651363672064
cebudailynews;2018-11-14 21:20;0;1;"Fire hits Barangay Lorega, Cebu City https://cebudailynews.inquirer.net/203596/fire-hi ts-barangay-lorega-cebu-city?utm_term=Autofeed&utm_medium=Social&utm_source=Twitter#Echobox=1542198022 …";;;#Echobox;"1062696893153730560";https://twitter.com/cebudailynews/status/1062696893153730560
InqNational;2018-11-14 17:54;3;2;"Fire hits Cebu village https://newsinfo.inquirer.net/1053704/fire-h its-cebu-village?utm_medium=Social&utm_source=Twitter#Echobox=1542189298 …";;;#Echobox;"1062645056367218689";https://twitter.com/InqNational/status/1062645056367218689
Cebuinformer;2018-11-14 17:53;0;0;"Fire hits Cebu village https://cebuinformer.com/221564/fire-hi ts-cebu-village/ … pic.twitter.com/7lskTUNYHV";;;;"1062644663616704512";https://twitter.com/Cebuinformer/status/1062644663616704512
cebudailynews;2018-11-14 17:09;0;0;"LOOK: Remains of Amado Opura who died in a fire that hit Barangay Lorega San Miguel, Cebu City | Junjie Mendoza pic.twitter.com/QwgwvHvUOw";;;;"1062633620534321152";https://twitter.com/cebudailynews/status/1062633620534321152
cebudailynews;2018-11-14 16:43;2;3;"One is confirmed dead after a fire struck a densely populated area in Barangay Lorega San Miguel, Cebu City past 3 p.m. today, Wednesday. Read more: https://cebudailynews.inquirer.net/203591/one-dea d-in-lorega-fire#ixzz5Woi1NNlN … pic.twitter.com/Ppa00n5D8p";;;#ixzz5Woi1NNlN;"1062627107648360448";https://twitter.com/cebudailynews/status/1062627107648360448
cebudailynews;2018-11-14 16:37;1;2;"LOOK: More scenes during the fire that hit Barangay Lorega, Cebu City | Junjie Mendoza pic.twitter.com/rjIZJHmFGV";;;;"1062625600576282624";https://twitter.com/cebudailynews/status/1062625600576282624
TheFreemanNews;2018-11-14 16:21;0;3;"LATEST: One dead in ongoing Lorega fire in Cebu City, confirms Fire Marshall Noel Nelson Ababon | via Rowena Capistrano pic.twitter.com/TChoylFwfs";;;;"1062621498026807296";https://twitter.com/TheFreemanNews/status/1062621498026807296
cebudailynews;2018-11-14 16:10;0;2;"LOOK: Cebu Vice Mayor Edgardo Labella comforted two kids after they were left behind by their family in a fire that hit Barangay Lorega, Cebu City | Junjie Mendoza pic.twitter.com/TWmvHha9IT";;;;"1062618740288708608";https://twitter.com/cebudailynews/status/1062618740288708608
cebudailynews;2018-11-14 16:08;2;0;"WATCH: Firefighters retrieve uncooked chicken that were left in a lechon-manok (roast chicken) station during the fire that hit Barangay Lorega, Cebu City | Morexette Erram pic.twitter.com/0e1nJQXsd2";;;;"1062618159851565056";https://twitter.com/cebudailynews/status/1062618159851565056
rapplerdotcom;2018-11-14 15:49;3;9;"Fire alert: A fire in Sitio San Miguel, Barangay Lorega, Cebu City has been raised to third alarm. : Jake Yap pic.twitter.com/elO1i6SgJ6";;;;"1062613501460471808";https://twitter.com/rapplerdotcom/status/1062613501460471808
sunstarcebu;2018-11-14 15:48;0;3;"NEWS UPDATE: The fire in Brgy. Lorega-San Miguel, Cebu City is now under control. | via Arnold Bustamante pic.twitter.com/2Y64kPRhYv";;;;"1062613287819309061";https://twitter.com/sunstarcebu/status/1062613287819309061
cebudailynews;2018-11-14 15:48;1;2;"Fire in Barangay Lorega, Cebu City now under control | @ememsanCDN https://twitter.com/cebudailynews/status/1062601046789316608 …";;@ememsanCDN;;"1062613185927106560";https://twitter.com/cebudailynews/status/1062613185927106560
BrgyTalamban;2018-11-14 15:41;0;0;"FIRE ALARM!!!! NEWS UPDATE: The fire which hit an urban poor community in Sitio San Miguel, Barangay Lorega, Cebu City was already raised to third alarm. The fire was reported at 3:08 p.m. and affected structures built along the new Imus road.";;;;"1062611586987294720";https://twitter.com/BrgyTalamban/status/1062611586987294720
sunstarcebu;2018-11-14 15:40;1;5;"LOOK: More scenes from the fire that hit a residential area in Brgy. Lorega-San Miguel, Cebu City. Firefighters continue to extinguish the blaze as the fire is still raised at third alarm. | Photo courtesy of Arnold Bustamante pic.twitter.com/usIc7gPkgg";;;;"1062611250092244992";https://twitter.com/sunstarcebu/status/1062611250092244992
4LifeTFCebu;2018-11-14 15:39;0;0;"ATM.. Fire in Progress MJ Cuenco Ave, Cebu City https://www.facebook.com/yddub.sisalliv /videos/2144307822280832/ …";;;;"1062611029572677632";https://twitter.com/4LifeTFCebu/status/1062611029572677632
cebudailynews;2018-11-14 15:33;1;2;"NEWS UPDATE: The fire which hit an urban poor community in Sitio San Miguel, Barangay Lorega, Cebu City was already raised to third alarm. The fire was reported at 3:08 p.m. and affected structures built along the new Imus road | @dbongcac pic.twitter.com/u0h74IL22O";;@dbongcac;;"1062609470906261504";https://twitter.com/cebudailynews/status/1062609470906261504
cebudailynews;2018-11-14 15:31;0;2;"LOOK: Scenes during the fire that hit Barangay Lorega, Cebu City | Junjie Mendoza pic.twitter.com/MyUGUks5CK";;;;"1062609041937981440";https://twitter.com/cebudailynews/status/1062609041937981440
sunstarcebu;2018-11-14 15:28;3;5;"LOOK: Scenes from the fire in Brgy. Lorega-San Miguel, Cebu City. As of 3:10 pm, the fire has been raised to third alarm. | Video courtesy of Kweni Rose Angie GracianoPiape pic.twitter.com/9RTV4FLSdq";;;;"1062608157535391744";https://twitter.com/sunstarcebu/status/1062608157535391744
TheFreemanNews;2018-11-14 15:27;1;2;"LOOK: Fire razes houses in Sitio San Miguel, Barangay Lorega, Cebu City | via Aldo Banaynal pic.twitter.com/FMRR3ntq5W";;;;"1062607917067624449";https://twitter.com/TheFreemanNews/status/1062607917067624449
cebudailynews;2018-11-14 15:24;3;15;"LOOK: Houses and establishments were burned in a fire that hit Barangay Lorega, Cebu City this afternoon ( November 14) | Junjie Mendoza and Paul Lauro pic.twitter.com/qtTKY8aHP9";;;;"1062607193877307393";https://twitter.com/cebudailynews/status/1062607193877307393
manilabulletin;2018-11-14 15:17;0;0;"#FireAlert : Ongoing fire at a residential area in Barangay Lorega, Cebu City | via @JuanCarloDeVel3 pic.twitter.com/LaiN7LJl8L";;@JuanCarloDeVel3;#FireAlert;"1062605371632627713";https://twitter.com/manilabulletin/status/1062605371632627713
dalegisrael;2018-11-14 15:09;0;1;"Breaking: Fire hits congested residential area in barangay Lorega-San Miguel in Cebu City. @cnnphilippines pic.twitter.com/3qtcCpDYHC";;@cnnphilippines;;"1062603386955063296";https://twitter.com/dalegisrael/status/1062603386955063296
cebudailynews;2018-11-14 15:08;1;3;"LOOK: Black smoke seen billowing from the fire in Barangay Lorega, Cebu City | Doris Mondragon pic.twitter.com/HFpBM6L0hw";;;;"1062603264972050432";https://twitter.com/cebudailynews/status/1062603264972050432
TheFreemanNews;2018-11-14 15:06;1;0;"BREAKING: Fire alarm in Lorega, Cebu City | via @jdestacamentoTF pic.twitter.com/sb2qicACSp";;@jdestacamentoTF;;"1062602709126197248";https://twitter.com/TheFreemanNews/status/1062602709126197248
sunstarcebu;2018-11-14 15:06;4;3;"BREAKING: Fire alarm in Lorega St., Cebu City. More details to follow. pic.twitter.com/43jXlrJzEl";;;;"1062602559855067136";https://twitter.com/sunstarcebu/status/1062602559855067136
renzodelro;2018-11-14 15:03;0;0;"FIRE ALARM IN PROGRESS LOCATION NEW LOREGA ROAD, BRGY. LOREGA, CEBU CITY INVOLVING RESIDENTIAL";;;;"1062601987936735232";https://twitter.com/renzodelro/status/1062601987936735232
cebudailynews;2018-11-14 15:00;2;4;"JUST IN: Authorities are now responding to a fire alarm in Barangay Lorega, Cebu City | Junjie Mendoza pic.twitter.com/SC0yPcUPoh";;;;"1062601046789316608";https://twitter.com/cebudailynews/status/1062601046789316608
TheFreemanNews;2018-11-14 11:48;0;0;"LATEST: Police: No one reported to us when the house of Tejero, Cebu City councilman was attempted to be set on fire | via @camilleTFBanat pic.twitter.com/qFlUEXH59p";;@camilleTFBanat;;"1062552738905624576";https://twitter.com/TheFreemanNews/status/1062552738905624576
sunstarcebu;2018-11-14 11:46;0;0;"LOOK: The house of City Councilor Jessielou Cadungog in Barangay Tejero, Cebu City. The fire , brought about by four arsonists, badly damaged the outdoor unit of the house's air conditioning system. | via KAL Read more: http://snstr.co/67U pic.twitter.com/SPbU5Moe7Z";;;;"1062552383257948160";https://twitter.com/sunstarcebu/status/1062552383257948160
TheFreemanNews;2018-11-14 10:21;0;1;"LATEST: Two motor-riding suspects -'attempted' to set the house of Tejero, Cebu City councilman Jessielou Cadungog on fire | @clydylavilaTF pic.twitter.com/RMSgUIvZ1N";;@clydylavilaTF;;"1062531033239760896";https://twitter.com/TheFreemanNews/status/1062531033239760896
angelblaizeee;2018-11-15 06:47;0;0;"it is because of the fire at lorega";;;;"1062839493797924865";https://twitter.com/angelblaizeee/status/1062839493797924865
Cebuinformer;2018-11-15 01:44;0;0;"30 houses went up in smoke: Lorega fire kills 1 https://cebuinformer.com/221587/30-hous es-went-up-in-smoke-lorega-fire-kills-1/ … pic.twitter.com/LB1QFJL4JN";;;;"1062763218542698496";https://twitter.com/Cebuinformer/status/1062763218542698496
baconncll;2018-11-14 22:17;0;0;"the fire at lorega affected the city and southern area";;;;"1062711200616574976";https://twitter.com/baconncll/status/1062711200616574976
HavenRm;2018-11-14 22:16;0;1;"no internet because of the fire in lorega";;;;"1062710971938988033";https://twitter.com/HavenRm/status/1062710971938988033
cebudailynews;2018-11-14 21:20;0;1;"Fire hits Barangay Lorega , Cebu City https://cebudailynews.inquirer.net/203596/fire-hi ts-barangay-lorega-cebu-city?utm_term=Autofeed&utm_medium=Social&utm_source=Twitter#Echobox=1542198022 …";;;#Echobox;"1062696893153730560";https://twitter.com/cebudailynews/status/1062696893153730560
AneliciousVllgs;2018-11-14 20:45;0;0;"one of the reasons why i won't board in lorega is because it is fire prone and there are a lot of bystanders";;;;"1062687884321255424";https://twitter.com/AneliciousVllgs/status/1062687884321255424
DelleraFaith;2018-11-14 19:24;1;8;"pray for lorega ! i got scared because a lot of firetrucks kept passing through our school a while ago.";;;;"1062667486145863681";https://twitter.com/DelleraFaith/status/1062667486145863681
atonibaicebu;2018-11-14 17:27;0;0;"Fire broke in Lorega https://www.facebook.com/10000854043337 6/posts/1968935793401083/ … https://www.facebook.com/cebucity/posts /10156723830151250 …";;;;"1062638166635622400";https://twitter.com/atonibaicebu/status/1062638166635622400
cebudailynews;2018-11-14 17:09;0;0;"LOOK: Remains of Amado Opura who died in a fire that hit Barangay Lorega San Miguel, Cebu City | Junjie Mendoza pic.twitter.com/QwgwvHvUOw";;;;"1062633620534321152";https://twitter.com/cebudailynews/status/1062633620534321152
atonibaicebu;2018-11-14 17:02;0;0;"Fire broke in Lorega https://www.facebook.com/10000854043337 6/posts/1968935793401083/ … https://www.facebook.com/311876150591/p osts/10155830028240592/ …";;;;"1062631929361645569";https://twitter.com/atonibaicebu/status/1062631929361645569
cebudailynews;2018-11-14 16:43;2;3;"One is confirmed dead after a fire struck a densely populated area in Barangay Lorega San Miguel, Cebu City past 3 p.m. today, Wednesday. Read more: https://cebudailynews.inquirer.net/203591/one-dea d-in-lorega-fire#ixzz5Woi1NNlN … pic.twitter.com/Ppa00n5D8p";;;#ixzz5Woi1NNlN;"1062627107648360448";https://twitter.com/cebudailynews/status/1062627107648360448
cebudailynews;2018-11-14 16:37;1;2;"LOOK: More scenes during the fire that hit Barangay Lorega , Cebu City | Junjie Mendoza pic.twitter.com/rjIZJHmFGV";;;;"1062625600576282624";https://twitter.com/cebudailynews/status/1062625600576282624
TheFreemanNews;2018-11-14 16:21;0;3;"LATEST: One dead in ongoing Lorega fire in Cebu City, confirms Fire Marshall Noel Nelson Ababon | via Rowena Capistrano pic.twitter.com/TChoylFwfs";;;;"1062621498026807296";https://twitter.com/TheFreemanNews/status/1062621498026807296
cebudailynews;2018-11-14 16:10;0;2;"LOOK: Cebu Vice Mayor Edgardo Labella comforted two kids after they were left behind by their family in a fire that hit Barangay Lorega , Cebu City | Junjie Mendoza pic.twitter.com/TWmvHha9IT";;;;"1062618740288708608";https://twitter.com/cebudailynews/status/1062618740288708608
cebudailynews;2018-11-14 16:08;2;0;"WATCH: Firefighters retrieve uncooked chicken that were left in a lechon-manok (roast chicken) station during the fire that hit Barangay Lorega , Cebu City | Morexette Erram pic.twitter.com/0e1nJQXsd2";;;;"1062618159851565056";https://twitter.com/cebudailynews/status/1062618159851565056
jmlcyc;2018-11-14 15:55;1;7;"March 14, 2014 (not sure if 14) June 26, 2016 November 14, 2018 really LOREGA ? EVERY TWO YEARS? Keep safe please, missing home https://twitter.com/sunstarcebu/st atus/1062611250092244992 …";;;;"1062614923082108928";https://twitter.com/jmlcyc/status/1062614923082108928
rapplerdotcom;2018-11-14 15:49;3;9;"Fire alert: A fire in Sitio San Miguel, Barangay Lorega , Cebu City has been raised to third alarm. : Jake Yap pic.twitter.com/elO1i6SgJ6";;;;"1062613501460471808";https://twitter.com/rapplerdotcom/status/1062613501460471808
cebudailynews;2018-11-14 15:48;1;2;"Fire in Barangay Lorega , Cebu City now under control | @ememsanCDN https://twitter.com/cebudailynews/status/1062601046789316608 …";;@ememsanCDN;;"1062613185927106560";https://twitter.com/cebudailynews/status/1062613185927106560
BrgyTalamban;2018-11-14 15:41;0;0;"FIRE ALARM!!!! NEWS UPDATE: The fire which hit an urban poor community in Sitio San Miguel, Barangay Lorega , Cebu City was already raised to third alarm. The fire was reported at 3:08 p.m. and affected structures built along the new Imus road.";;;;"1062611586987294720";https://twitter.com/BrgyTalamban/status/1062611586987294720
TheQueenMika;2018-11-14 15:38;0;0;"Lorega kuno";;;;"1062610741390262272";https://twitter.com/TheQueenMika/status/1062610741390262272
henry_manatad;2018-11-14 15:37;0;0;"Fire in Barangay Lorega - San Miguel along Imus Road. Heavy traffic in the connecting General Maxilom Ave. and M.J. Cuenco Avenue";;;;"1062610532371435525";https://twitter.com/henry_manatad/status/1062610532371435525
cebudailynews;2018-11-14 15:33;1;2;"NEWS UPDATE: The fire which hit an urban poor community in Sitio San Miguel, Barangay Lorega , Cebu City was already raised to third alarm. The fire was reported at 3:08 p.m. and affected structures built along the new Imus road | @dbongcac pic.twitter.com/u0h74IL22O";;@dbongcac;;"1062609470906261504";https://twitter.com/cebudailynews/status/1062609470906261504
cebudailynews;2018-11-14 15:31;0;2;"LOOK: Scenes during the fire that hit Barangay Lorega , Cebu City | Junjie Mendoza pic.twitter.com/MyUGUks5CK";;;;"1062609041937981440";https://twitter.com/cebudailynews/status/1062609041937981440
TheFreemanNews;2018-11-14 15:27;1;2;"LOOK: Fire razes houses in Sitio San Miguel, Barangay Lorega , Cebu City | via Aldo Banaynal pic.twitter.com/FMRR3ntq5W";;;;"1062607917067624449";https://twitter.com/TheFreemanNews/status/1062607917067624449
cebudailynews;2018-11-14 15:24;3;15;"LOOK: Houses and establishments were burned in a fire that hit Barangay Lorega , Cebu City this afternoon ( November 14) | Junjie Mendoza and Paul Lauro pic.twitter.com/qtTKY8aHP9";;;;"1062607193877307393";https://twitter.com/cebudailynews/status/1062607193877307393
loladebbi;2018-11-14 15:24;0;0;"fire at Lorega , Imus Road";;;;"1062607059869294592";https://twitter.com/loladebbi/status/1062607059869294592
kinyanggg;2018-11-14 15:20;0;1;"lorega keeps having fire";;;;"1062606295478366209";https://twitter.com/kinyanggg/status/1062606295478366209
cebudailynews;2018-11-14 15:17;0;0;"Fire alarm in Barangay Lorega now raised to third alarm. https://twitter.com/cebudailynews/status/1062601046789316608 …";;;;"1062605472874749952";https://twitter.com/cebudailynews/status/1062605472874749952
manilabulletin;2018-11-14 15:17;0;0;"#FireAlert : Ongoing fire at a residential area in Barangay Lorega , Cebu City | via @JuanCarloDeVel3 pic.twitter.com/LaiN7LJl8L";;@JuanCarloDeVel3;#FireAlert;"1062605371632627713";https://twitter.com/manilabulletin/status/1062605371632627713
John60561446;2018-11-14 15:14;0;0;"fire at lorega . https://www.facebook.com/Johnreyisyour0 2/videos/735698006763558/ …";;;;"1062604697847152640";https://twitter.com/John60561446/status/1062604697847152640
cebudailynews;2018-11-14 15:08;1;3;"LOOK: Black smoke seen billowing from the fire in Barangay Lorega , Cebu City | Doris Mondragon pic.twitter.com/HFpBM6L0hw";;;;"1062603264972050432";https://twitter.com/cebudailynews/status/1062603264972050432
TheFreemanNews;2018-11-14 15:06;1;0;"BREAKING: Fire alarm in Lorega , Cebu City | via @jdestacamentoTF pic.twitter.com/sb2qicACSp";;@jdestacamentoTF;;"1062602709126197248";https://twitter.com/TheFreemanNews/status/1062602709126197248
sunstarcebu;2018-11-14 15:06;4;3;"BREAKING: Fire alarm in Lorega St., Cebu City. More details to follow. pic.twitter.com/43jXlrJzEl";;;;"1062602559855067136";https://twitter.com/sunstarcebu/status/1062602559855067136
renzodelro;2018-11-14 15:03;0;0;"FIRE ALARM IN PROGRESS LOCATION NEW LOREGA ROAD, BRGY. LOREGA , CEBU CITY INVOLVING RESIDENTIAL";;;;"1062601987936735232";https://twitter.com/renzodelro/status/1062601987936735232
bnloid;2018-11-14 15:00;0;7;"fire again at LOREGA";;;;"1062601077932011520";https://twitter.com/bnloid/status/1062601077932011520
cebudailynews;2018-11-14 15:00;2;4;"JUST IN: Authorities are now responding to a fire alarm in Barangay Lorega , Cebu City | Junjie Mendoza pic.twitter.com/SC0yPcUPoh";;;;"1062601046789316608";https://twitter.com/cebudailynews/status/1062601046789316608