username;date;retweets;favorites;text;geo;mentions;hashtags;id;permalink
nerowattz;2018-01-07 07:31;0;0;"Cebu store fire to burn for 3 more days http:// inq.ph/inqmobileapp InquirerMobile http:// ift.tt/2COY8X0";;;;"949785441275957249";https://twitter.com/nerowattz/status/949785441275957249
cebudailynews;2018-01-07 07:30;3;11;"BANNER STORY: FIRE IN THE METRO - Cebu Daily News https:// shar.es/1NpgMx pic.twitter.com/oumF8xdS8m";;;;"949785149691932673";https://twitter.com/cebudailynews/status/949785149691932673
GrahamPearcy;2018-01-07 07:21;0;0;"Cebu mall fire may take 2 days to put out, officials say http:// news.abs-cbn.com/news/01/06/18/ cebu-mall-fire-may-take-2-days-to-put-out-officials-say … via @ABSCBNNews";;@ABSCBNNews;;"949783032377913344";https://twitter.com/GrahamPearcy/status/949783032377913344
cebudailynews;2018-01-07 07:00;1;4;"TODAY'S FRONT PAGE: FIRE IN THE METRO - Cebu Daily News https:// shar.es/1NppWh pic.twitter.com/4z9YS3zC2l";;;;"949777600406159360";https://twitter.com/cebudailynews/status/949777600406159360
WeAreTheDi;2018-01-07 05:55;0;0;"So... where do the people who live in the condos go, then? I hope they're okay. I can't believe the fire is still going. Cebu fires don't usually last this long.";;;;"949761340897243137";https://twitter.com/WeAreTheDi/status/949761340897243137
manilainformer;2018-01-07 05:37;0;0;"Fire hits Cebu mall https:// manilainformer.com/283143/fire-hi ts-cebu-mall/ …";;;;"949756887876153345";https://twitter.com/manilainformer/status/949756887876153345
trendandviral;2018-01-07 05:26;0;0;"Ayala Mall on Fire , Cebu City 2018 http:// youtu.be/92MSax9d4GA?a";;;;"949754102170505216";https://twitter.com/trendandviral/status/949754102170505216
trendandviral;2018-01-07 05:26;0;0;"I added a video to a @YouTube playlist http:// youtu.be/92MSax9d4GA?a Ayala Mall on Fire , Cebu City 2018";;@YouTube;;"949754086089478145";https://twitter.com/trendandviral/status/949754086089478145
inquirerdotnet;2018-01-07 05:26;0;0;"Probers checking for violations of safety rules in Cebu mall fire http:// ebx.sh/2m651ZS";;;;"949754024345075712";https://twitter.com/inquirerdotnet/status/949754024345075712
Shoes_4;2018-01-07 04:41;0;0;"Two backhoe operators caught stealing shoes during Cebu mall fire - http:// Inquirer.net : http:// Inquirer.net Two backhoe operators caught stealing shoes during Cebu mall fire http:// Inquirer.net CEBU CITY – Two backhoe operators were arrested… http:// news.google.com/news/url?sa=t& fd=R&ct2=us&usg=AFQjCNFAgZAxZIYFLhCLz32pbIu4PFVvVA&clid=c3a7d30bb8a4878e06b80cf16b898331&cid=52779751898547&ei=QTRRWoCCKZaXqwLkvIbQBg&url=https%3A%2F%2Fnewsinfo.inquirer.net%2F958012%2Ftwo-backhoe-operators-caught-stealing-shoes-during-cebu-mall-fire&utm_source=dlvr.it&utm_medium=twitter …";;;;"949742632556572672";https://twitter.com/Shoes_4/status/949742632556572672
arniezoned;2018-01-07 03:20;1;2;"Kudos to BFP that they able to control the fire in Metro Ayala Cebu . I think it took them more than 24hours to manipulate the fire . But the smoke caused by the fire in intolerable. Our company’s building is just across Metro Ayala. #safe #metroayalacebu pic.twitter.com/LX7EmyulbU";;;#safe #metroayalacebu;"949722464010907648";https://twitter.com/arniezoned/status/949722464010907648
ohhthesea;2018-01-07 02:55;0;5;"Mahurot nalang ang tubig sa Cebu wala pa napalong ang kalayo sa Metro Ayala. But srsly, all thoughts and hopes for all the people who are working tirelessly to put down the fire";;;;"949716104577925120";https://twitter.com/ohhthesea/status/949716104577925120
bdsaguing;2018-01-07 02:40;0;0;"Retweeted Cebu Daily News ( @cebudailynews ): LOOK: As of 1:30 a.m., firefighters continue to put out fire of... https:// fb.me/1uhyOS6Kh";;@cebudailynews;;"949712290177323010";https://twitter.com/bdsaguing/status/949712290177323010
cebudailynews;2018-01-07 02:31;2;4;"The fire , for still unknown reason, broke out at 9:44 p.m. on Friday inside a toy stock room on the third floor of the Metro Ayala department store, an eight-level building that formed part of the sprawling Ayala Center Cebu mall complex located at the Cebu Business Park.";;;;"949709924811993088";https://twitter.com/cebudailynews/status/949709924811993088
cebudailynews;2018-01-07 02:29;1;2;"Tadeo said they remained under Task Force Bravo, which means that the presence of all firefighting units from as far as Danao City in the north and Naga City in the south are still needed to assist the Cebu City Fire Department in battling the Metro Ayala fire .";;;;"949709470841561088";https://twitter.com/cebudailynews/status/949709470841561088
cebudailynews;2018-01-07 02:29;1;1;"Cebu City Disaster Risk Reduction Management Office (CDRRMO) Chief Nagiel Bañacia earlier said that at least 50 fire trucks have responded to the fire alarm since Friday evening.";;;;"949709468077469696";https://twitter.com/cebudailynews/status/949709468077469696
inquirerdotnet;2018-01-07 02:23;7;9;"Cebu City mall fire rekindles 24 hours after breaking out http:// ebx.sh/2m7JD6B";;;;"949708088084451328";https://twitter.com/inquirerdotnet/status/949708088084451328
DZMMTeleFeed;2018-01-07 02:20;0;0;"Haze alert, itinaas sa Cebu dept. store fire";;;;"949707136086433792";https://twitter.com/DZMMTeleFeed/status/949707136086433792
Cebuinformer;2018-01-07 02:10;0;0;"Probers checking for violations of safety rules in Cebu mall fire https:// cebuinformer.com/186247/probers -checking-for-violations-of-safety-rules-in-cebu-mall-fire/ … pic.twitter.com/8NQMlFKsxt";;;;"949704813264228352";https://twitter.com/Cebuinformer/status/949704813264228352
EileenMaeEPere1;2018-01-07 01:27;0;1;"We might as well expect a new Metro Ayala coz the way I see it, the building is no longer safe due to the fire . My very first memory upon arriving in Cebu 19 yrs ago was to buy my toiletries there. My boarding house was just a block away then.";;;;"949693982606467072";https://twitter.com/EileenMaeEPere1/status/949693982606467072
wyanetalcibar;2018-01-07 01:26;0;1;"This breaks my heart. Two backhoe operators caught stealing shoes during Cebu mall fire https:// newsinfo.inquirer.net/958012/two-bac khoe-operators-caught-stealing-shoes-during-cebu-mall-fire … via @inquirerdotnet";;@inquirerdotnet;;"949693721259294720";https://twitter.com/wyanetalcibar/status/949693721259294720
nerowattz;2018-01-07 01:25;0;0;"Probers checking for violations of safety rules in Cebu mall fire http:// inq.ph/inqmobileapp InquirerMobile http:// ift.tt/2qzbWiM";;;;"949693323094175744";https://twitter.com/nerowattz/status/949693323094175744
nerowattz;2018-01-07 01:25;0;0;"Cebu City mall fire rekindles 24 hours after breaking out http:// inq.ph/inqmobileapp InquirerMobile http:// ift.tt/2D1YG99";;;;"949693320971931648";https://twitter.com/nerowattz/status/949693320971931648
Cebuinformer;2018-01-07 01:08;0;0;"Cebu City mall fire rekindles 24 hours after breaking out https:// cebuinformer.com/186240/cebu-ci ty-mall-fire-rekindles-24-hours-after-breaking-out/ … pic.twitter.com/NVKypVX1Kh";;;;"949689045990477825";https://twitter.com/Cebuinformer/status/949689045990477825
TheManilaTimes;2018-01-07 00:51;0;0;"Fire hits mall in Cebu https:// goo.gl/D34AhZ pic.twitter.com/JSmAGrP59c";;;;"949684843398316033";https://twitter.com/TheManilaTimes/status/949684843398316033
ZXPN247;2018-01-07 00:48;0;0;"#ZXPN News | Cebu city mall fire still rages; alarm raised http:// manilastandard.net/news/top-stori es/255707/cebu-city-mall-fire-still-rages-alarm-raised.html …";;;#ZXPN;"949684066496008192";https://twitter.com/ZXPN247/status/949684066496008192
MDEmon313;2018-01-07 00:43;0;0;"Live Updates: Fire hits Metro Ayala mall in Cebu City | Fire hits Metro Gaisano Ayala Cebu : http:// youtu.be/taaNJTxtDWA?a via @YouTube";;@YouTube;;"949682840110796800";https://twitter.com/MDEmon313/status/949682840110796800
cebu_news_en;2018-01-07 00:21;0;0;"(UPDATED) -- Haze alert has been raised over Cebu Business Park where the fire that engulfed Metro A... / SunStar Cebu https:// goo.gl/nx4MSZ pic.twitter.com/xe7JYqHldo";;;;"949677316539670528";https://twitter.com/cebu_news_en/status/949677316539670528
cebu_news_zh;2018-01-07 00:21;0;0;"FIRE 威胁要摧毁具有里程碑意义的Metro Ayala百货公司和超市，这是上市的Gaisano拥有的Metro Retail Stores Group，Inc.（MRSGI）的最大销售点之一。 / SunStar Cebu https:// goo.gl/einLWE pic.twitter.com/3dxR3lE0Se";;;;"949677306678833153";https://twitter.com/cebu_news_zh/status/949677306678833153
cebu_news_ko;2018-01-07 00:21;0;0;"FIRE 는 나열된 Gaisano 소유의 Metro Retail Stores Group, Inc. (MRSGI)의 가장 큰 매장 중 하나 인 Metro Ayala 백화점 및 슈퍼마켓... / SunStar Cebu https:// goo.gl/19gHiA pic.twitter.com/xFYFeUvWqc";;;;"949677290501345280";https://twitter.com/cebu_news_ko/status/949677290501345280
cebu_news_ja;2018-01-07 00:21;0;0;"FIRE は、リストされているGaisano所有のMetro Retail Stores Group、Inc.（MRSGI）の最大の店舗の1つであるランドマークMetro Ayala百貨店とスーパーマー... / SunStar Cebu https:// goo.gl/ddFxHZ pic.twitter.com/52lVhHXunc";;;;"949677271815778304";https://twitter.com/cebu_news_ja/status/949677271815778304
cebu_news_en;2018-01-07 00:21;0;0;"FIRE threatens to destroy the landmark Metro Ayala department store and supermarket, one of the bigg... / SunStar Cebu https:// goo.gl/uHMyDF pic.twitter.com/JECWkEc1Aw";;;;"949677254413574145";https://twitter.com/cebu_news_en/status/949677254413574145
SurgeonPilgrim;2018-01-07 00:17;0;0;"Cebu mall fire may take 2 days to put out, officials say http:// news.abs-cbn.com/news/01/06/18/ cebu-mall-fire-may-take-2-days-to-put-out-officials-say … via @ABSCBNNews";;@ABSCBNNews;;"949676275794288640";https://twitter.com/SurgeonPilgrim/status/949676275794288640
lorenzruiz_06;2018-01-07 00:11;0;0;"Safe from cebu city fire kuno pero one week na naas bantayan kwanggol gyud";;;;"949674822853828608";https://twitter.com/lorenzruiz_06/status/949674822853828608
erinabera;2018-01-07 00:11;0;0;"It's actually really difficult since sometimes, reception can be shitty and we have to redirect our call to another employee in the BFP (preferably the one nearest to the fire , tho sometimes it goes to Cebu City because of the inaccessibility)";;;;"949674698681475072";https://twitter.com/erinabera/status/949674698681475072
gibzrodado;2018-01-06 23:50;6;43;"My prayer goes to all the volunteers, firefighters and to anyone who has been any of help in aiding Metro Ayala Cebu fire incident. Let us pray for a well safe rain that would cause no harm to us but somehow ease and lessen the inconvenience and burden brought by the fire .";;;;"949669502920228864";https://twitter.com/gibzrodado/status/949669502920228864
manilainformer;2018-01-06 23:48;0;0;"Fire hits mall in Cebu https:// manilainformer.com/283089/fire-hi ts-mall-in-cebu/ …";;;;"949668973922213888";https://twitter.com/manilainformer/status/949668973922213888
kurisucchi;2018-01-06 23:43;0;3;"Seriously let Cebu have heavy rain shower so that the fire in the mall will stop. The firemen have been working so hard and I’m sure they’re really tired.. it’s similar to code white in the hospital for medical staff >_<";;;;"949667847688544256";https://twitter.com/kurisucchi/status/949667847688544256
ZXPN247;2018-01-06 23:33;0;0;"#ZXPN News | Fire hits mall in Cebu http://www. manilatimes.net/fire-hits-mall -cebu/372732/ …";;;#ZXPN;"949665144157728768";https://twitter.com/ZXPN247/status/949665144157728768
JM_Villarin;2018-01-06 23:29;0;2;"Origin of the fire was from the department store, right? That's a lot of flammable material right there. Plus very few spaces for air to come out. Not so different when Gaisano Capital in downtown Cebu caught fire .";;;;"949664201148055552";https://twitter.com/JM_Villarin/status/949664201148055552
PINOYNetworkPH;2018-01-06 23:26;0;0;"Two Men Caught Stealing Shoes During Fire at Metro Ayala Mall in Cebu http:// adobotoday.com/?p=12806";;;;"949663356557737984";https://twitter.com/PINOYNetworkPH/status/949663356557737984
PINOYNetworkPH;2018-01-06 23:25;0;0;"Two Men Caught Stealing Shoes During Fire at Metro Ayala Mall in Cebu https:// goo.gl/fb/3ymr9Y";;;;"949663294549192704";https://twitter.com/PINOYNetworkPH/status/949663294549192704
oohwsam;2018-01-06 23:22;0;1;"Metro Ayala Cebu still on fire around 22:00. pic.twitter.com/nNzN76qmHr";;;;"949662427607519233";https://twitter.com/oohwsam/status/949662427607519233
sgwafa_mae;2018-01-06 23:05;0;0;"News Update: Fire at Cebu City https:// fb.me/4cPnuwekg";;;;"949658194376261632";https://twitter.com/sgwafa_mae/status/949658194376261632
itsmeFebyG;2018-01-06 23:02;0;0;"noh! my g. last year NCCC mall davao fire disaster. then yesterday, Metro Gaisano Ayala Cebu na sad. then until now wala pa na.agapan ang sunog. noh! keep safe everyone! keep safe Cebu .";;;;"949657492480344064";https://twitter.com/itsmeFebyG/status/949657492480344064
exgangleader;2018-01-06 22:55;0;1;"Is the fire already out in metro ayala cebu ? :(";;;;"949655713617362944";https://twitter.com/exgangleader/status/949655713617362944
ThePacificast;2018-01-06 22:52;0;0;"#PacificastNewsfeed | Cebu city mall fire still rages; alarm raised http:// ift.tt/2CvPI2D";;;#PacificastNewsfeed;"949654825880444928";https://twitter.com/ThePacificast/status/949654825880444928
gennapi_qt;2018-01-06 22:52;0;5;"Wow so many notifications! "Barbie, Ken, Annaliza, and 2948 × 10^29 marked themselves safe during The Fire in Cebu , Ayala metro." I'm still lonely";;;;"949654815428132864";https://twitter.com/gennapi_qt/status/949654815428132864
gmanews;2018-01-06 22:46;21;38;"Putting out fire at Ayala mall in Cebu may take 2 more days http:// gmane.ws/2EdKc5m";;;;"949653280510144512";https://twitter.com/gmanews/status/949653280510144512
Xclusifeu;2018-01-06 22:28;0;1;".@radfacebooklive Fire in Cebu Live https://www. pscp.tv/radfacebookliv e/1dRJZbQdXXAJB …";;@radfacebooklive;;"949648808069287937";https://twitter.com/Xclusifeu/status/949648808069287937
chemapua;2018-01-06 22:26;0;0;"fire in cebu mall still on going hoping no ones hurt https:// fb.me/7Jn6oZCuo";;;;"949648251313045505";https://twitter.com/chemapua/status/949648251313045505
franzpalanca;2018-01-06 22:17;2;1;"Kudos to all Cebu Fire Volunteers!";;;;"949646061508820994";https://twitter.com/franzpalanca/status/949646061508820994
teffanyjean;2018-01-06 22:14;0;0;"Laysho Cebu , sunog ang Ayala pero may pa drone mga beshy para makuha lang jud ang nice shots sa mall while on fire .";;;;"949645290058870784";https://twitter.com/teffanyjean/status/949645290058870784
TishaDoris;2018-01-06 22:10;0;0;"Is this tonight @cebudailynews ? #MetroAyala #Cebu #fire https:// twitter.com/cebudailynews/ status/949639517291491328 …";;@cebudailynews;#MetroAyala #Cebu #fire;"949644394772152321";https://twitter.com/TishaDoris/status/949644394772152321
phildaily;2018-01-06 22:03;0;0;"Putting out fire at Ayala mall in Cebu may take 2 more days - GMA News https:// goo.gl/fb/gjKRJ9";;;;"949642598838427648";https://twitter.com/phildaily/status/949642598838427648
yusufledesma;2018-01-06 22:00;1;1;"Two backhoe operators caught stealing shoes during Cebu mall fire http:// newsinfo.inquirer.net/958012/two-bac khoe-operators-caught-stealing-shoes-during-cebu-mall-fire … via @inquirerdotnet";;@inquirerdotnet;;"949641938998722561";https://twitter.com/yusufledesma/status/949641938998722561
NofNewsFilipino;2018-01-06 21:59;0;0;"Cebu mall fire may take 2 days to put out, officials say MANILA – Local disaster officials on Saturday ... https:// goo.gl/uw2kAY";;;;"949641607753576449";https://twitter.com/NofNewsFilipino/status/949641607753576449
agentTMARIS;2018-01-06 21:51;0;7;"Til now wala pa diay na pawng ang fire sa Metro Ayala Cebu";;;;"949639535754817536";https://twitter.com/agentTMARIS/status/949639535754817536
F_GR01;2018-01-06 21:50;0;0;"Putting out fire at Ayala mall in Cebu may take 2 more days http:// dlvr.it/Q97lky #philippines pic.twitter.com/JHhdfgDoAZ";;;#philippines;"949639217096704001";https://twitter.com/F_GR01/status/949639217096704001
itsmonang;2018-01-06 21:49;0;0;"I think if was organised properly the fire could been contained ASAP #MetroAyalaFire #Cebu";;;#MetroAyalaFire #Cebu;"949639128362053638";https://twitter.com/itsmonang/status/949639128362053638
GMANewsTVIntl;2018-01-06 21:44;0;0;"Putting out fire at Ayala mall in Cebu may take 2 more days http:// dlvr.it/Q97kP8 pic.twitter.com/CQPiNVpPuc";;;;"949637879914946560";https://twitter.com/GMANewsTVIntl/status/949637879914946560
joeliamarie;2018-01-06 21:39;3;51;"Props to all the fireman who is putting down the Metro Ayala fire ! You guys are one of the reasons why I see beauty in Cebu , selfless individuals.";;;;"949636467868889089";https://twitter.com/joeliamarie/status/949636467868889089
sly_lefty;2018-01-06 21:35;0;1;"Seeing Ayala go down is just sad with all the memories burning with it #AyalaCebu #fireCebu";;;#AyalaCebu #fireCebu;"949635422954467330";https://twitter.com/sly_lefty/status/949635422954467330
lenasti16;2018-01-06 21:31;0;0;"Oh, NO!!! The fire challenge continues!!! My poor, Metro Ayala Cebu ... Almost 24 hrs now… https://www. instagram.com/p/BdnADofhWfA/";;;;"949634489956872192";https://twitter.com/lenasti16/status/949634489956872192
HavenorFantasy;2018-01-06 21:30;0;0;"Fire in Cebu is continuing unfortunately. It's taking so long to put out! #Cebu #MetroAyalaFire #fire #tragedy #Philippines #CebuCity #Cebuano https:// twitter.com/manilabulletin /status/949633761687232513 …";;;#Cebu #MetroAyalaFire #fire #tragedy #Philippines #CebuCity #Cebuano;"949634238063681536";https://twitter.com/HavenorFantasy/status/949634238063681536
RogramJr;2018-01-06 21:29;1;2;"I pray for heavy rain in Metro Cebu Papa God. To help put out that blazing fire in Metro Gaisano Ayala. Good heavens please.";;;;"949634141028429825";https://twitter.com/RogramJr/status/949634141028429825
manilabulletin;2018-01-06 21:28;5;5;"WATCH: Fire is already visible at the upper floor of Metro Ayala in Cebu City at the moment. | @kierbellezaMB https:// twitter.com/kierbellezaMB/ status/949629364907384833/video/1 …";;@kierbellezaMB;;"949633761687232513";https://twitter.com/manilabulletin/status/949633761687232513
peterbruce;2018-01-06 21:27;0;2;"Hey Cebu pals, is Ayala mall on fire ?";;;;"949633549476487168";https://twitter.com/peterbruce/status/949633549476487168
runningismylif2;2018-01-06 21:25;0;1;"Update on Ayala Mall Fire , Cebu City, 6th Jan 2018 https:// youtu.be/4fObpPE34Kk via @YouTube";;@YouTube;;"949633099670855680";https://twitter.com/runningismylif2/status/949633099670855680
templeofgoon;2018-01-06 21:25;1;2;"Ayala’s on fire ! #cebu pic.twitter.com/m9VnlvlxJY";;;#cebu;"949632986655244288";https://twitter.com/templeofgoon/status/949632986655244288
dnegayosa;2018-01-06 21:22;1;1;"Firetrucks are still rushing back and forth for a day now. The fire in the Ayala Mall Cebu is not yet under control.";;;;"949632318590746626";https://twitter.com/dnegayosa/status/949632318590746626
leirei7_7;2018-01-06 21:22;0;6;"#Ayala center Cebu fire is still on with more power pic.twitter.com/av1FgP6rQT";;;#Ayala;"949632227343650817";https://twitter.com/leirei7_7/status/949632227343650817
cebudailynews;2018-01-06 21:16;63;81;"UPDATE: Fire continues to engulf Metro Ayala for 24 hours. Smoke continues to billow the areas near Cebu Business Park / via @BenjieTalisic pic.twitter.com/AvOakONVyI";;@BenjieTalisic;;"949630686981365760";https://twitter.com/cebudailynews/status/949630686981365760
VJlastimado11;2018-01-06 21:14;0;2;"keep the firefighters and the volunteers safe, Lord. The fire is so big at Metro Ayala Cebu";;;;"949630344092835847";https://twitter.com/VJlastimado11/status/949630344092835847
cebudailynews;2018-01-06 21:02;26;34;"LOOK: Firefight efforts are still going to put out the fire at Metro Ayala. Smoke continues to billow areas near Cebu Business Park / via Henry Yu pic.twitter.com/OXvW3mYfcj";;;;"949627152332304386";https://twitter.com/cebudailynews/status/949627152332304386
qatarday;2018-01-06 20:59;0;0;"Cebu Officials: Metro Ayala Mall Fire Might Take 2 Days To Put Out #philippine #MallFire https:// fb.me/1xHsRJgjW";;;#philippine #MallFire;"949626505004535810";https://twitter.com/qatarday/status/949626505004535810
changjf18;2018-01-06 20:58;0;1;"I'm outside of my room near the window for fresh air and the wifi is faster but I'm going to die from the smoke. Metro Ayala Cebu is still not okay. There is still smoke from the fire last night and it looks like downtown is having fog because of that.";;;;"949626205656965120";https://twitter.com/changjf18/status/949626205656965120
Cebuinformer;2018-01-06 20:56;0;0;"Putting out fire at Ayala mall in Cebu may take 2 more days https:// cebuinformer.com/186224/putting -out-fire-at-ayala-mall-in-cebu-may-take-2-more-days/ … pic.twitter.com/DgofxwsDPG";;;;"949625606551015427";https://twitter.com/Cebuinformer/status/949625606551015427
LOCALNEWSNgayon;2018-01-06 20:55;0;0;"Putting out fire at Ayala mall in Cebu may take 2 more days | Read: http:// ift.tt/2qy7mkW via GMA News";;;;"949625380096397312";https://twitter.com/LOCALNEWSNgayon/status/949625380096397312
manilainformer;2018-01-06 20:53;0;0;"Putting out fire at Ayala mall in Cebu may take 2 more days https:// manilainformer.com/283055/putting -out-fire-at-ayala-mall-in-cebu-may-take-2-more-days/ … pic.twitter.com/VXYmC4fBbN";;;;"949625023903518726";https://twitter.com/manilainformer/status/949625023903518726
ChrisVills;2018-01-06 20:31;0;9;"SERIOUSLY CEBU NOW IS THE TIME THAT WE NEED RAIN! Apparently metro ayala floors are starting to fall down. Fire was under control, then they chilled down, and something else caught fire again and burned the place even more.";;;;"949619495127035904";https://twitter.com/ChrisVills/status/949619495127035904
blogginoy;2018-01-06 20:28;0;0;"The view from nearby Lahug, Cebu City. It seems like the firemen stopped fighting the blaze. The Metro Gaisano fire is getting worse nearing 24 hours of burning. @bayanmo pic.twitter.com/7Y7IbngurE";;@bayanmo;;"949618562527719424";https://twitter.com/blogginoy/status/949618562527719424
dalegisrael;2018-01-06 20:26;0;0;"LOOK: because of the ongoing fire , haze covers most roads surrounding Metro in Ayala Center Cebu as far as three blocs away @cnnphilippines pic.twitter.com/eMYtNLqRhj";;@cnnphilippines;;"949618063904681985";https://twitter.com/dalegisrael/status/949618063904681985
nerowattz;2018-01-06 20:25;0;0;"Two backhoe operators caught stealing shoes during Cebu mall fire http:// inq.ph/inqmobileapp InquirerMobile http:// ift.tt/2EckKNG";;;;"949617837571825664";https://twitter.com/nerowattz/status/949617837571825664
cnnphilippines;2018-01-06 20:08;16;38;"LOOK: Situation at the Metro Gaisano in Ayala Center Cebu . Fire still in progress as of 6 p.m. | @dalegisrael pic.twitter.com/F8GrbRGoXE";;@dalegisrael;;"949613745411522562";https://twitter.com/cnnphilippines/status/949613745411522562
dalegisrael;2018-01-06 20:04;1;1;"Look: situation at the Metro Gaisano in Ayala Center Cebu . Fire still in progress as of 6pm @cnnphilippines pic.twitter.com/kJqLUVw2f0";;@cnnphilippines;;"949612734810800129";https://twitter.com/dalegisrael/status/949612734810800129
Nel_dalvi;2018-01-06 19:56;0;1;"Cebu mall fire controlled in 2 days: CCDRRMO - http:// ptvnews.ph/cebu-mall-fire -controlled-2-days-ccdrrmo/ …";;;;"949610604091924480";https://twitter.com/Nel_dalvi/status/949610604091924480
MiniPhils;2018-01-06 19:52;0;0;"#BREAKING : Cebu City under haze alert due to mall fire , Leleth Rumaguera reports. #ANCRecap";;;#BREAKING #ANCRecap;"949609539027873792";https://twitter.com/MiniPhils/status/949609539027873792
sunstaronline;2018-01-06 19:36;1;2;"Fire hits Metro Ayala Center Cebu : http:// youtu.be/TSnFUZYF5HY?a via @YouTube";;@YouTube;;"949605567328382976";https://twitter.com/sunstaronline/status/949605567328382976
sunstaronline;2018-01-06 19:29;14;45;"JUST IN. The Hotels Resort and Restaurant Association of Cebu (HRRAC) members are donating water and packed meals to the men and women in the fire department, and the volunteers in the #MetroAyalaFire - HRRAC president Carlo Suarez pic.twitter.com/SlU9ykk0pb";;;#MetroAyalaFire;"949603794672906240";https://twitter.com/sunstaronline/status/949603794672906240
cecilemdimaano;2018-01-06 19:14;0;1;"Ayala Center Cebu 's still on fire ? Grabeha oy! Hope everyone's safe there!";;;;"949600024576516097";https://twitter.com/cecilemdimaano/status/949600024576516097
RielHolganza;2018-01-06 19:11;0;0;"RT ANCALERTS " Cebu City under haze alert due to mall fire , Leleth Rumaguera reports. #ANCRecap pic.twitter.com/g926BkLskd "";;;#ANCRecap;"949599248206745600";https://twitter.com/RielHolganza/status/949599248206745600
ANCALERTS;2018-01-06 19:08;10;24;"Cebu City under haze alert due to mall fire , Leleth Rumaguera reports. #ANCRecap pic.twitter.com/uxuddaRj8D";;;#ANCRecap;"949598569354285057";https://twitter.com/ANCALERTS/status/949598569354285057
RielHolganza;2018-01-06 19:06;0;0;"RT ANCALERTS "ON THE PHONE: Leleth Ann Rumaguera gives update on Cebu City Mall fire . pic.twitter.com/Q1YL3DsFlw "";;;;"949597949348208640";https://twitter.com/RielHolganza/status/949597949348208640
ANCALERTS;2018-01-06 19:05;0;6;"ON THE PHONE: Leleth Ann Rumaguera gives update on Cebu City Mall fire . pic.twitter.com/A4dKdwstRy";;;;"949597819165274113";https://twitter.com/ANCALERTS/status/949597819165274113
philmonitor;2018-01-06 18:49;0;1;"Cebu Officials: Metro Ayala Mall Fire Might Take 2 Days To Put Out - http://www. philmonitor.com/news/2018/01/c ebu-officials-metro-ayala-mall-fire-might-take-2-days-to-put-out/ … via @philmonitor";;@philmonitor;;"949593796219736064";https://twitter.com/philmonitor/status/949593796219736064
